{
  "connection_id": "CONN-PUBLIC-DUMMY-001",
  "provider": "naver_talktalk",
  "region": "kr",
  "environment": "test",
  "mode": "read_only",
  "credential_ref": null,
  "capabilities": [
    {
      "name": "webhook_ingest",
      "support": "supported",
      "access_mode": "read_only",
      "source_ref": "https://github.com/navertalk/chatbot-api"
    },
    {
      "name": "conversation_backfill",
      "support": "unconfirmed",
      "access_mode": "read_only",
      "source_ref": "https://github.com/navertalk/chatbot-api"
    },
    {
      "name": "reply_send",
      "support": "disabled_by_policy",
      "access_mode": "draft_only",
      "source_ref": "https://github.com/navertalk/chatbot-api"
    }
  ],
  "retention_policy_ref": "POL-PUBLIC-DUMMY",
  "approved_by": null,
  "verified_at": null,
  "external_write_enabled": false
}
